Id,Question,Answer
1,What is Moldova's capital?,"Chisinau is the capital of Moldova."
2,Which are the major cities in Moldova?,"Chisinau, Tiraspol, and Balti."
3,What is Moldova's population?,"Moldova has a population of 2.6 million people."
4,What currency is used in Moldova?,"The Moldovan Leu is the currency of Moldova."
5,Which languages are commonly spoken in Moldova?,"Romanian and Russian are widely spoken in Moldova."
6,What is the climate in Moldova?,"Moldova has a mild and comfortable climate."
7,What is Moldova's national dish?,"Tocana with Mamaliga is a traditional dish."
8,What is the national drink of Moldova?,"Moldova's national drink is wine."
9,Which music bands are popular in Moldova?,"Carla's Dreams, Zdob si Zdub, and O-Zone are popular bands."
10,What are Moldovans proud of?,"Moldovans are proud of their culture, history, and wine."
11,What are the main districts in Chisinau?,"Botanica, Buiucani, and Centru are key districts."
12,Which suburbs are closest to Chisinau?,"Durlesti, Colonita, and Singera are major suburbs."
13,What public transport options are in Chisinau?,"Buses, trolleybuses, and minibuses serve Chisinau."
14,Which trolleybus routes are the most used?,"Trolleybus routes 22 and 10 are frequently used."
15,Which shopping malls are in Chisinau?,"Popular malls include Malldova, PortMall, and Sun City."
16,Which parks are well-known in Chisinau?,"Valea Morilor and Valea Trandafirilor are popular parks."
17,Where can I eat affordably in Chisinau?,"Das Kebab and Culinaria de la Linella offer affordable meals."
18,Where can I try traditional Moldovan food?,"Restaurants like Andy's Pizza and La Placinte offer traditional dishes."
19,What are the main transport hubs in Chisinau?,"The key transport hubs are train stations and the airport."
20,Which universities are prominent in Chisinau?,"The largest universities are UTM, USM, USMF, and ASEM."
21,What does USM stand for?,"USM stands for State University of Moldova."
22,What does UTM stand for?,"UTM stands for Technical University of Moldova."
23,What does USMF stand for?,"USMF stands for State University of Medicine and Pharmacy."
24,What does ASEM stand for?,"ASEM stands for Academy of Economic Studies of Moldova."
25,Which taxi services are in Moldova?,"Taxi services include YandexGo, Letz, and Hip."
26,What ecological transport is available in Chisinau?,"Electric scooters and bicycles are popular for eco-friendly transport."
27,Which museums are popular in Chisinau?,"National History Museum and Ethnography Museum are popular spots."
28,What is Moldova's emergency phone number?,"Dial 112 for ambulance, police, or fire emergencies."
29,Are there public health institutions in Chisinau?,"Yes, there are public hospitals and polyclinics in each district."
30,Are private medical facilities in Chisinau?,"Private facilities like ProMed and Medpark are available."
31,What medical labs are in Chisinau?,"Popular labs include Invitro Diagnostics and Synevo."
32,What religious institutions are in Moldova?,"Moldova has Orthodox, Catholic, and Jewish places of worship."
33,Where can I solve administrative issues?,"Local ASP offices can assist with administrative matters."
34,Where do I handle residence permit issues?,"The Bureau of Migration handles residence permit matters."
35,Which are the top software companies in Moldova?,"Endava and Pentalog are major software companies."
36,Which job platforms are used in Moldova?,"Jobber and RabotaMd are popular job search platforms."
37,What are the best banks in Moldova?,"Maib, Moldindconbank, and Victoriabank are highly rated."
38,Where can I exchange currency in Moldova?,"Currency exchange is available at banks and exchange offices."
39,Where can I watch movies in Chisinau?,"Patria Cinema is a popular spot for movies."
40,What are the top theatres in Chisinau?,"The National Opera and Ballet Theatre are well-known."
41,Where can I buy event tickets?,"ITicket and AfishaMd offer tickets for cultural events."
42,How much is public transport in Chisinau?,"A single transport ticket costs 6 Lei."
43,What transport passes are available in Chisinau?,"Passes for 1, 3, or 6 months are available for buses and trolleybuses."
44,Where can I find public transport routes?,"Check bus stations or use the EasyWay app."
45,Where can I rent apartments in Chisinau?,"You can rent apartments through platforms like 999."
46,What are the best resorts in Moldova?,"Vadul lui Voda and Costesti-Stinca are top resorts."
47,Where are the best places for local shopping?,"Piata Centrala offers fresh produce and local goods."
48,What is the largest airport in Moldova?,"Chisinau International Airport is the largest."
49,Which festivals are celebrated in Moldova?,"The Wine Festival and Martisor Festival are major events."
50,When is the best time to visit Moldova?,"The best time to visit is from May to September."
51,What is Moldova's famous natural landmark?,"Orheiul Vechi Monastery is a well-known natural site."
52,What is the most popular drink in Moldova?,"Moldovans mainly drink local wine."
53,How to get around Chisinau?,"Public transport such as buses and trolleybuses are convenient."
54,What is Chisinau's area?,"Chisinau covers around 120 square kilometers."
55,Where are the best views in Chisinau?,"Stefan Cel Mare Park and Valea Morilor offer great views."
56,What is Chisinau's main architecture style?,"Chisinau features Soviet and Neo-Classical architecture."
57,What is the official language of Moldova?,"Romanian is the official language."
58,What government system does Moldova have?,"Moldova is a parliamentary republic."
59,What is the largest lake in Moldova?,"Lake Beleu is Moldova's largest lake."
60,Is Moldova in the European Union?,"No, Moldova is not an EU member but has a partnership agreement."
61,What is Moldova's highest point?,"Mount Balanesti is the highest point at 430 meters."
62,What industries are important in Moldova?,"Agriculture and food processing are major industries."
63,What wine region is famous in Moldova?,"The Cricova wine cellars are famous for wine production."
64,What historical site is significant in Chisinau?,"The Stefan Cel Mare Park is a key historical site."
65,Where can I buy traditional crafts in Moldova?,"You can find traditional crafts in museums and local markets."
66,What is Moldova's main river?,"The Nistru River is the main river in Moldova."
67,What dessert is popular in Moldova?,"Placinta, a pastry, is a favorite dessert."
68,What is Moldova's average winter temperature?,"Winter temperatures average around -2°C."
69,How many official languages are there in Moldova?,"Romanian is the official language, with Russian spoken widely."
70,What food is most popular in Moldova?,"Mamaliga, tocana, and sarmale are common dishes."
71,Where can I taste traditional Moldovan food?,"La Placinte and Andy's Pizza offer traditional dishes."
72,Does Chisinau have a vibrant nightlife?,"Yes, Chisinau has a lively nightlife scene."
73,How much is public transport in Chisinau?,"The fare is 6 Lei per ride on buses and trolleybuses."
74,What is Moldova's flag design?,"Moldova's flag has blue, yellow, and red stripes with the coat of arms."
75,Which wine brand is famous in Moldova?,"Cricova is the most well-known wine brand."
76,What religion is most practiced in Moldova?,"Eastern Orthodox Christianity is the main religion."
77,How to get a visa for Moldova?,"You can apply through the Moldovan embassy or consulate."
78,What time zone is Moldova in?,"Moldova is in the Eastern European Time Zone (EET)."
79,What sports are popular in Moldova?,"Football, rugby, and athletics are major sports."
80,What outdoor activities are popular in Chisinau?,"You can walk in parks, hike in forests, or cycle."
81,What is Moldova's top cultural event?,"The Wine Festival is the top cultural event."
82,What does Moldova export?,"Moldova exports wine, fruits, and textiles."
83,What is the largest airport in Moldova?,"Chisinau International Airport is the largest."
84,What festivals are celebrated in Moldova?,"The Wine Festival and Martisor are popular."
85,What season is best for visiting Moldova?,"Spring and summer (May to September) are ideal for visits."
86,What natural landmark is famous in Moldova?,"The Orheiul Vechi Monastery is well-known."
87,What drink is most consumed in Moldova?,"Wine, particularly Feteasca Neagra, is very popular."